{
  "schema_version": "1.0.0",
  "source": "github-inspector",
  "source_version": "0.1.0-fixture",
  "run_id": "fixture-0001",
  "collected_at": "2026-04-13T15:04:10Z",
  "resource": {
    "type": "github_repository",
    "id": "acme/billing-svc",
    "uri": "https://github.com/acme/billing-svc",
    "account_id": "acme"
  },
  "evaluations": [
    {
      "control_framework": "SCF",
      "control_id": "CHG-02",
      "status": "pass",
      "severity": "info"
    },
    {
      "control_framework": "SCF",
      "control_id": "MON-01",
      "status": "pass",
      "severity": "info"
    }
  ]
}
